677,北京创新爱尚家科技股份有限公司,GR202311001812,新材料
678,北京伊士通新材料发展有限公司,GR202311003086,新材料
679,北京垒实科技有限公司,GR202311001661,新能源与节能
680,北京金博众科技有限公司,GR202311001319,新能源与节能
681,北京德科一品建筑工程有限公司,GR202311003047,新能源与节能
682,北京跬远科技发展有限公司,GR202311002668,新能源与节能
683,中环汇峰环境科技（北京）有限公司,GR202311002251,资源与环境
684,北京航天威科环保科技有限公司,GR202311000986,资源与环境
685,北京市首发天人生态景观有限公司,GR202311001200,资源与环境
686,北京格大环境工程有限公司,GR202311003337,资源与环境
687,北京博信晟益环保科技有限公司,GR202311002013,资源与环境
688,北京良乡蓝鑫水利工程设计有限公司,GR202311002846,资源与环境
689,北京山水之光园林工程有限公司,GR202311001385,资源与环境
690,北京航天恒丰科技股份有限公司,GS202311000030,生物与新医药
691,北京航景创新科技有限公司,GS202311000112,航空航天
692,北京汉德天启科技有限公司,GR202311004681,电子信息
693,北京智通天行信息技术有限公司,GR202311004621,电子信息
694,北京助力互联信息技术有限公司,GR202311005295,电子信息
695,北京亿东信息科技有限公司,GR202311005355,电子信息
696,北京康吉森技术有限公司,GR202311004368,电子信息
697,北京尚层生泰技术有限公司,GR202311004306,电子信息
698,中细软集团有限公司,GR202311004231,电子信息
699,中信科佳信（北京）电气技术研究院有限公司,GR202311005488,电子信息
700,能科科技股份有限公司,GR202311005676,电子信息
701,北京偶极通信设备有限责任公司,GR202311003580,电子信息
702,北京中机盛世科技有限公司,GR202311004641,电子信息
703,华晟国科(北京)科技有限公司,GR202311005547,电子信息
704,北京永泰万德信息工程技术有限公司,GR202311004461,电子信息
705,北京天拓数信科技有限责任公司,GR202311005306,电子信息
706,北京中泰高安安全科技有限公司,GR202311004137,电子信息
707,北京君时慧成科技有限公司,GR202311004166,电子信息
708,北京天德科技有限公司,GR202311004833,电子信息
709,北京善事祺文化传媒有限公司,GR202311004473,电子信息
710,北京华宇恒通工程咨询有限公司,GR202311004263,高技术服务
711,北京博远信诚科技发展有限公司,GR202311004901,高技术服务
712,北京云智软通信息技术有限公司,GR202311003676,高技术服务
713,北京燕山石化特种设备检验有限公司,GR202311004611,高技术服务
714,北京博隆设备安装有限公司,GR202311003935,高技术服务
715,中昌泰(北京)建设集团有限公司,GR202311003831,高技术服务
716,北京艺力文化发展有限公司,GR202311005262,高技术服务
717,未来盒子(北京)建筑科技有限公司,GR202311005502,高技术服务
718,北京恒天云端科技有限公司,GR202311004552,高技术服务
719,中核原子能院科技有限公司,GR202311003514,高技术服务
720,北京金朋达航空科技有限公司,GR202311003729,航空航天
721,北京香豆豆食品有限公司,GR202311005206,生物与新医药
722,燕开电气股份有限公司,GR202311005307,先进制造与自动化
723,北京疏水阀门厂,GR202311003652,先进制造与自动化
724,北京安赛克科技有限公司,GR202311005637,先进制造与自动化
725,北京北方松阳机械技术有限公司,GR202311005565,先进制造与自动化
726,北京朗德金燕自动化装备股份有限公司,GR202311004783,先进制造与自动化
727,北京益华信达煤矿机械有限公司,GR202311005231,先进制造与自动化
728,北京梦幻三星涂装设备技术开发公司,GR202311005733,先进制造与自动化
729,北京百正创源科技有限公司,GR202311004950,先进制造与自动化
730,北京同圆能源技术有限公司,GR202311003568,先进制造与自动化
731,北京中宝元科技发展有限责任公司,GR202311005246,先进制造与自动化
732,北京燕山粉研精机有限公司,GR202311005737,先进制造与自动化
733,北京国电龙庆科技有限公司,GR202311003529,先进制造与自动化
734,博能华医疗器械（北京）有限公司,GR202311005039,新材料
735,北京方硕复合材料技术有限公司,GR202311004352,新材料
736,北京金洋润滑油有限公司,GR202311004402,新材料
737,国控基业（北京）科技有限公司,GR202311003825,新材料
738,北京燕化集联光电技术有限公司,GR202311004503,新材料
739,北京聚菱燕塑料有限公司,GR202311003966,新材料
740,北京燕山石化高科技术有限责任公司,GR202311005073,新材料
741,北京玖乾信息科技有限公司,GR202311005588,新能源与节能
742,北京国风建业门窗制造有限公司,GR202311003569,新能源与节能
743,北京华亿宏图机电设备有限公司,GR202311005239,新能源与节能
744,北京首诚建设有限公司,GR202311004391,新能源与节能
745,北京斯泰科空调制冷设备有限责任公司,GR202311003513,新能源与节能
746,北京弘昇达环境科技有限公司,GR202311005703,资源与环境
747,尊峰环保科技有限公司,GR202311003613,资源与环境
748,北京盈宝泰科环保科技股份有限公司,GR202311003565,资源与环境
749,北京中亚康源环保工程有限公司,GR202311005133,资源与环境
750,北京九州尚阳科技有限公司,GR202311004280,资源与环境
751,北京智诚环保工程有限公司,GR202311005144,资源与环境
752,北京东方启源环保科技有限公司,GR202311005182,资源与环境
753,北京华元环境生态技术有限公司,GR202311004291,资源与环境
754,北京理明智能科技有限公司,GR202311006969,电子信息
755,北京晴空软创科技有限公司,GR202311009258,电子信息
756,中网安科（北京）科技发展有限公司,GR202311006335,电子信息
757,北京瑞德合创科技发展有限公司,GR202311007797,电子信息
758,北京宽途科技有限公司,GR202311008434,电子信息
759,北京恒泰鑫飞科技有限公司,GR202311006581,电子信息
760,北京牧江科技有限公司,GR202311009066,电子信息
761,安信云（北京）科技有限公司,GR202311006602,电子信息
762,北京斯诺达科技有限公司,GR202311006331,电子信息
763,中税诚（北京）科技有限公司,GR202311007183,电子信息
764,北京易博中天科技有限公司,GR202311010191,电子信息
765,北京中科软信科技有限公司,GR202311008008,电子信息
766,北京宇天智通科技有限公司,GR202311006927,电子信息
767,北京数字众智科技有限公司,GR202311006496,电子信息
768,北京艾克信信息技术有限公司,GR202311009578,电子信息
769,北京数字力量智能科技有限公司,GR202311009949,电子信息
770,北京环宇汇智科技有限公司,GR202311007168,电子信息
771,北京尚信诚科技有限公司,GR202311006136,电子信息
772,北京奥特贝睿科技有限公司,GR202311006376,电子信息
773,北京安胜华信科技有限公司,GR202311006700,电子信息
774,北京智见科技有限责任公司,GR202311007749,电子信息
775,北京眷诚铁道工程技术有限公司,GR202311008093,高技术服务
776,北京燕山玉龙石化工程股份有限公司,GR202311006810,高技术服务
777,北京汇智航教育科技有限公司,GR202311007684,高技术服务
778,北京蔻凯恒安咨询有限公司,GR202311007326,高技术服务
779,元禾（北京）信息咨询有限公司,GR202311008388,高技术服务
780,北京嘉华铭品牌策划有限公司,GR202311007073,高技术服务
781,北京天和嘉业国际建筑装饰工程有限公司,GR202311008121,高技术服务
782,北京贰拾玖画数字科技有限公司,GR202311008587,高技术服务
783,北京绥邦文化发展有限公司,GR202311007834,高技术服务
784,北京一联科技有限公司,GR202311007788,高技术服务
785,美拍拍（北京）智能科技有限公司,GR202311007492,高技术服务
786,北京唐竹科技有限公司,GR202311007617,高技术服务
787,北京启腾焱园林绿化有限公司,GR202311007361,高技术服务
788,北京博睿京开文化科技有限公司,GR202311009555,高技术服务
789,北京海和自控科技有限公司,GR202311007483,高技术服务
790,北京航鑫融军科技有限公司,GR202311008417,高技术服务
791,巴伯瑞（北京）国际建筑科技有限公司,GR202311007975,高技术服务
792,天算量化（北京）资本管理有限公司,GR202311008772,高技术服务
793,北京爱妈爱娃健康科技有限公司,GR202311010060,高技术服务
794,华软盛科技有限公司,GR202311010027,高技术服务
795,北京华微云科技有限公司,GR202311008051,高技术服务
796,北京智同道和科技有限公司,GR202311006218,高技术服务
797,晟创意（北京）科技有限公司,GR202311006388,高技术服务
798,北京四方五洲仪器有限公司,GR202311005980,高技术服务
799,必奥新能源科技有限公司,GR202311006955,高技术服务
800,北京百辰航科科技有限公司,GR202311008565,航空航天
801,北京海为科技有限公司,GR202311010234,航空航天
802,北京航科京工科技有限责任公司,GR202311008941,航空航天
803,海鹰航空通用装备有限责任公司,GR202311007899,航空航天
804,迅能仪器（北京）有限公司,GR202311007840,生物与新医药
805,北京首诚田园科技发展有限公司,GR202311010220,生物与新医药
806,北京首诚农业发展有限公司,GR202311008897,生物与新医药
807,航天（北京）食品技术研究院,GR202311007773,生物与新医药
808,北京周氏时珍堂药业有限公司,GR202311005859,生物与新医药
809,北京成宇化工有限公司,GR202311009522,生物与新医药
810,北京中禾伟业食品有限公司,GR202311009693,生物与新医药
811,北京环球利康科技有限公司,GR202311009399,生物与新医药
812,京之源（北京）农业有限公司,GR202311010163,生物与新医药
813,北京绿野药业有限公司,GR202311009499,生物与新医药
814,北京深港药业有限公司,GR202311007064,生物与新医药
815,北京德麦特捷康科技发展有限公司,GR202311009727,生物与新医药
816,北京吉艾姆仪器有限公司,GR202311010026,生物与新医药
817,北京核原科电电气有限公司,GR202311009501,先进制造与自动化
818,北京航天荣航科技发展中心,GR202311008047,先进制造与自动化
819,中煤（北京）印务有限公司,GR202311006595,先进制造与自动化
820,东方和装备科技（北京）有限公司,GR202311006680,先进制造与自动化
821,北京隆轩橡塑有限公司,GR202311007699,先进制造与自动化
822,北京妙王电气自动化技术有限公司,GR202311009833,先进制造与自动化
823,北京燕化中天电控设备有限责任公司,GR202311006248,先进制造与自动化
824,北京航力安太科技有限责任公司,GR202311008140,先进制造与自动化
825,北京中消睿安科技发展有限公司,GR202311006473,先进制造与自动化
826,北京广利新东科技有限公司,GR202311009043,新材料
827,安迈特科技（北京）有限公司,GR202311009467,新材料
828,北京贵存通风管业有限公司,GR202311006241,新材料
829,北京安禹建设有限公司,GR202311006676,新能源与节能
830,北京净与境生态科技有限公司,GR202311008999,新能源与节能
831,北京胜比泰和节能技术有限公司,GR202311007041,新能源与节能
832,北京金都汇普新能源科技有限公司,GR202311008715,新能源与节能
833,北京北方国建塑业有限公司,GR202311009708,新能源与节能
834,北京梨源纸箱厂,GR202311006885,资源与环境
835,北京绿艺新源建设发展有限公司,GR202311009224,资源与环境
836,北京京燕水务有限公司,GR202311010171,资源与环境
837,北京沃思原科技发展有限公司,GR202311008485,资源与环境
838,北京天珠药业有限公司,GR202311008199,生物与新医药
839,北京豪龙恺建设集团有限公司,GR202311007573,高技术服务
840,北京煋邦数码科技有限公司,GS202311000164,电子信息
841,北京九矿医药有限公司,GR202311009017,生物与新医药
842,北京领平高新科技有限公司,GR202311006530,电子信息
843,北京金硕雷波科技有限公司,GR202311006767,电子信息
844,北京引驰科技有限公司,GR202311006900,高技术服务
845,北京威添科技有限公司,GR202311007148,高技术服务
846,北京燃气房山有限责任公司,GR202311007740,高技术服务
847,北京爱神永生科技有限公司,GR202311007826,新能源与节能
848,北京摩瑞特智能设备技术有限公司,GR202311007428,先进制造与自动化
849,北京企星冶金机电技术工程有限责任公司,GR202311006494,先进制造与自动化
850,北京清尚工坊文化传媒有限公司,GR202311009886,高技术服务
851,北京中教鼎汇科技有限公司,GR202311007867,高技术服务
852,中企商服（北京）科技有限公司,GR202311007204,高技术服务
853,北京戎兴装备科技有限公司,GR202311006038,高技术服务
854,北京一力建设有限公司,GR202311009407,高技术服务
855,北京徽尚科技有限公司,GR202311006452,先进制造与自动化
856,北京燕山中海建筑安装有限公司,GR202311007144,先进制造与自动化
857,北京硕乐科技发展有限责任公司,GR202311007491,高技术服务
858,北京思朋硕科技有限公司,GR202311007869,高技术服务
859,北京亚太鸿基建设工程有限公司,GR202311008884,先进制造与自动化
860,北京德蜂堂健康科技有限公司,GR202311008049,生物与新医药
861,北京耀炫恒业科技发展有限公司,GR202311009754,电子信息
862,北京久源科技有限公司,GR202311005940,先进制造与自动化
863,北京首文投文化科技有限公司,GR202311009022,电子信息
864,翰科天成（北京）城市更新科技发展有限公司,GR202311007154,电子信息
865,北京优泰信和科技发展有限公司,GR202311006896,新能源与节能
866,北京梆梆青蓝科技有限公司,GR202311009655,高技术服务
867,理道新材（北京）科技有限公司,GR202311007378,新材料
868,国鼎基创（北京）科技有限公司,GR202311009039,资源与环境
869,在线场景（北京）科技有限公司,GR202311007934,高技术服务
870,北京道信科技有限公司,GR202311007202,航空航天
871,北京嘉安科瑞科技发展有限公司,GR202311006655,电子信息
872,北京良明宇航节能动力装备技术开发中心,GR202311009245,先进制造与自动化
873,北京优指时代科技有限公司,GR202311009937,电子信息
874,北京捷联七星科技有限公司,GR202311007098,航空航天
875,华数医为（北京）医疗科技有限公司,GR202311005854,生物与新医药
876,北京苏柏亚科技有限公司,GR202311007717,高技术服务
877,凡仕检测技术服务有限公司,GR202311006372,高技术服务
878,北京中科华贸科技有限公司,GR202311009119,高技术服务
879,北京东方智荣知识产权代理有限公司,GR202311007576,高技术服务
880,北京阶梯计划科技有限公司,GR202311008209,高技术服务
881,北京千人千面网络技术有限公司,GR202311006046,高技术服务
882,北京华智电科技有限公司,GR202311008300,高技术服务
883,北京优能绿源科技有限公司,GR202311008444,先进制造与自动化
884,北京华虹嘉实科技有限公司,GR202311009972,高技术服务
885,启珑微电子（北京）有限公司,GR202311009668,电子信息
886,达闼科技（北京）有限公司,GR202311009597,电子信息
887,北京豪钥科技股份有限公司,GR202311006497,电子信息
888,三维六度（北京）文化有限公司,GR202311007558,电子信息
889,北京云山世纪科技有限公司,GR202311006076,高技术服务
890,北京柏华众和公关顾问有限公司,GR202311007214,高技术服务
891,北京首页文化传媒有限公司,GR202311007223,高技术服务
892,北京海聚博源科技孵化器有限公司,GR202311008426,高技术服务
893,中晟博远（北京）建设发展有限公司,GR202311008400,高技术服务
894,北京长鼎电气科技有限公司,GR202311008753,高技术服务
895,北京新助力科技有限公司,GR202311009312,高技术服务
896,北京金科汇智科技有限公司,GR202311006431,高技术服务
897,北京天象新亚科技有限公司,GR202311007902,高技术服务
898,北京利合世旺教育科技有限公司,GR202311008832,高技术服务
899,原兴核技术（北京）有限公司,GR202311009545,高技术服务
900,北京航科恒益科技有限责任公司,GR202311006037,航空航天
901,北京卓宸畜牧有限公司,GR202311008369,生物与新医药
902,北京震旦鼎泰生物科技有限公司,GR202311009917,生物与新医药
903,北京迈格泰克科技有限公司,GR202311010041,生物与新医药
904,北京筑之道工程技术有限公司,GR202311007406,高技术服务
905,北京瑶光高科科技有限公司,GR202311009677,先进制造与自动化
906,北京燕凯设备制造有限公司,GR202311010077,先进制造与自动化
907,北京酷思帝克门窗有限公司,GR202311010127,先进制造与自动化
908,摩玛智能（北京）科技有限公司,GR202311008367,先进制造与自动化
909,北京盛原通达科技有限公司,GR202311005884,先进制造与自动化
910,北京第二机床厂有限公司,GR202311010200,先进制造与自动化
911,北京万智石油化工有限公司,GR202311005985,新材料
912,北京和尔泰新材料科技有限公司,GR202311008484,新材料
913,北京威远恒通科技发展有限公司,GR202311009473,新材料
914,北京碳阳科技有限公司,GR202311005975,新材料
915,北京鸿润中茂科技有限公司,GR202311010302,先进制造与自动化
916,小柿子（北京）汽车供应链管理有限公司,GR202311010289,先进制造与自动化
917,中石化催化剂（北京）有限公司,GR202311010306,新材料
918,北京龙凤呈祥医院管理有限公司,GR202311010407,新材料
919,北京劲威环保科技发展有限公司,GR202311010425,新材料
920,北京世纪海森防水材料有限公司,GR202311010437,新材料
921,云家园在线（北京）科技有限公司,GR202311010424,电子信息
922,北京亚西会展服务有限责任公司,GR202311010449,电子信息
