339,北京旭锐科技有限公司,GR202211002559,新材料
340,北京易联结科技发展有限公司,GR202211001533,新材料
341,中国石化润滑油北京有限责任公司,GR202211004409,新材料
342,北京奥克森节能环保科技有限公司,GR202211002855,新材料
343,北京智天新航科技有限公司,GR202211002605,新材料
344,北京博君智能科技有限公司,GR202211001820,新能源与节能
345,北京华电力拓能源科技有限公司,GR202211002591,资源与环境
346,北京誉天利化工有限公司,GR202211002569,资源与环境
347,北京中丹节能环保科技有限公司,GR202211001973,资源与环境
348,北京金甲壳虫环境科技股份有限公司,GR202211001572,资源与环境
349,华航环境发展有限公司,GR202211002059,资源与环境
350,绿源通环保科技（北京）有限公司,GR202211002252,资源与环境
351,北京燕山威立雅水务有限责任公司,GR202211002575,资源与环境
352,北京中科绿电节能环保工程有限责任公司,GR202211001652,资源与环境
353,北京净河佳业环保科技有限公司,GR202211001359,资源与环境
354,北京新远时代环境技术有限公司,GR202211001307,资源与环境
355,北京智汇盈科信息工程有限公司,GR202211003045,电子信息
356,北京翊云科技有限公司,GR202211004454,电子信息
357,北京众晖同创科技有限公司,GR202211003119,电子信息
358,北京浩鸿达科技发展股份公司,GR202211003185,电子信息
359,北京时代科华科技有限公司,GR202211003747,电子信息
360,安途保（北京）信息技术有限公司,GR202211003419,电子信息
361,北京信银智达科技有限公司,GR202211003423,电子信息
362,北京亿柯科技服务有限公司,GR202211004890,高技术服务
363,北京科易多闻工程技术有限公司,GR202211004740,高技术服务
364,北京乐文石油化工研究院,GR202211004932,高技术服务
365,北京星诺科技有限公司,GR202211004781,高技术服务
366,北京启龙图教育科技有限公司,GR202211003017,高技术服务
367,北京渡众机器人科技有限公司,GR202211003441,先进制造与自动化
368,北京拓疆者智能科技有限公司,GR202211003276,先进制造与自动化
369,北京晋太机械设备有限公司,GR202211004757,先进制造与自动化
370,中巨建设有限公司,GR202211002994,新能源与节能
371,北京江山恒远科技有限公司,GR202211005069,资源与环境
372,北京艾森泰科科技有限责任公司,GR202211004885,资源与环境
373,高路易航（北京）科技有限公司,GR202211003918,电子信息
374,北京青矩互联科技有限公司,GR202211004957,电子信息
375,北京意中意教育装备有限公司,GR202211004325,电子信息
376,达闼机器人（北京）有限公司,GR202211003820,电子信息
377,北京能科瑞元数字技术有限公司,GR202211004092,电子信息
378,北京电联港电器设备有限责任公司,GR202211004938,电子信息
379,北京国信融通科技有限公司,GR202211004219,电子信息
380,智慧云显（北京）科技有限公司,GR202211003294,电子信息
381,精诚工坊电子集成技术（北京）有限公司,GR202211004642,电子信息
382,中广宽带网络有限公司,GR202211004552,电子信息
383,国华鹏源股份有限公司,GR202211004660,电子信息
384,北京电科智擎科技有限公司,GR202211004752,电子信息
385,北京线点科技有限公司,GR202211003071,电子信息
386,北京小马科技有限公司,GR202211004209,电子信息
387,北京凌欧科技有限公司,GR202211005039,电子信息
388,北京湜沅科技有限公司,GR202211004930,电子信息
389,中安华智（北京）工程技术有限公司,GR202211003867,电子信息
390,北京申朴信息技术有限公司,GR202211004414,电子信息
391,北京弘毅重远科技有限公司,GR202211003094,电子信息
392,北京百赛盛科技有限公司,GR202211003202,高技术服务
393,北京仁和惠康科技有限公司,GR202211003928,高技术服务
394,北京中科蓝图科技有限公司,GR202211004653,高技术服务
395,北京智慧科林新能源科技有限公司,GR202211003476,高技术服务
396,北京奥祥智造科技有限公司,GR202211004575,高技术服务
397,北京智仁通和岩土科技有限公司,GR202211004621,高技术服务
398,北京云科凯创信息技术有限公司,GR202211003010,高技术服务
399,北京鼎尖世纪广通物流有限公司,GR202211003383,高技术服务
400,北京丰和嘉业电力工程设计有限公司,GR202211004630,高技术服务
401,网博雅乐（北京）文化传媒有限公司,GR202211003599,高技术服务
402,北京一建工程有限公司,GR202211003308,高技术服务
403,北京北重中顺汽车技术检测有限公司,GR202211003746,高技术服务
404,北京兴源联合医药科技有限公司,GR202211004707,高技术服务
405,北京方象科技有限公司,GR202211003065,高技术服务
406,北京联能利达科技有限公司,GR202211003084,高技术服务
407,北京乐居旅游文化发展有限公司,GR202211003292,高技术服务
408,北京元鲜记食品科技有限公司,GR202211005037,生物与新医药
409,北京神鹿医疗器械有限公司,GR202211003945,生物与新医药
410,北京怡诺科技有限公司,GR202211004005,生物与新医药
411,北京晨淼科技有限公司,GR202211004396,先进制造与自动化
412,北京枢享科技有限公司,GR202211003034,先进制造与自动化
413,北京市重型电缆厂,GR202211004606,先进制造与自动化
414,北京韩建河山管业股份有限公司,GR202211005023,先进制造与自动化
415,北京丁力达矿山设备有限公司,GR202211005045,先进制造与自动化
416,北京昊泽瑞鑫节能设备有限公司,GR202211004223,新能源与节能
417,北京燕化天钲建筑工程有限责任公司,GR202211004520,新能源与节能
418,联方云天能源技术（北京）有限公司,GR202211004972,新能源与节能
419,中锦泰（北京）建筑工程有限公司,GR202211003166,新能源与节能
420,北京超拓能源科技有限公司,GR202211003661,新能源与节能
421,北京新华高科新能源技术有限公司,GR202211004368,新能源与节能
422,北京长远腾飞建筑工程有限公司,GR202211003114,新能源与节能
423,德瑞洁能科技有限公司,GR202211003159,新能源与节能
424,北京韩晶苡琳科技有限公司,GR202211003676,新能源与节能
425,新源智储能源发展（北京）有限公司,GR202211003584,新能源与节能
426,北京燕钲混凝土配送有限公司,GR202211004118,资源与环境
427,北京晟龙伟嘉科技有限公司,GR202211004181,资源与环境
428,北京碧鑫水务有限公司,GR202211004016,资源与环境
429,北京百秀京林园林绿地养护有限公司,GR202211004722,资源与环境
430,北京中天恒远环保设备有限公司,GR202211003469,资源与环境
431,北京众悦安燃气设备有限公司,GR202211004417,资源与环境
432,北京金隅琉水环保科技有限公司,GR202211004365,资源与环境
433,北京首铁总建环保工程有限公司,GR202211004110,资源与环境
434,北京晶电华阳科技发展有限公司,GR202211003168,电子信息
435,北京国原新技术有限公司,GR202211006551,资源与环境
436,北京京大元环保技术有限公司,GR202211008315,资源与环境
437,北京华禹清源水务科技有限公司,GR202211008169,资源与环境
438,北京日月兴彩印包装有限公司,GR202211007682,资源与环境
439,北京沁润泽环保科技有限公司,GR202211006652,资源与环境
440,北京碧源嘉德水务有限公司,GR202211007376,资源与环境
441,北京碧圣达优检测技术有限公司,GR202211006843,资源与环境
442,北京美景华夏环保科技有限公司,GR202211005659,资源与环境
443,中恒国盛能源科技有限公司,GR202211006727,新能源与节能
444,中国原子能科学研究院,GR202211006414,新能源与节能
445,北京易生综合能源有限公司,GR202211006359,新能源与节能
446,北京环宇盈享建筑有限公司,GR202211005584,新能源与节能
447,氢山科技有限公司,GR202211008258,新能源与节能
448,北京东霖混凝土制品有限公司,GR202211005397,新能源与节能
449,北京德克浦智慧能源科技有限公司,GR202211006237,新能源与节能
450,北京航宇顺昌装饰工程有限公司,GR202211007052,新能源与节能
451,北京中进开元科技发展有限公司,GR202211007005,新能源与节能
452,北冰建设工程（北京）有限公司,GR202211007415,新能源与节能
453,北京云艺风尚科技有限公司,GR202211006898,新能源与节能
454,北京裕金科技有限公司,GR202211005916,新材料
455,北京绿城易筑科技有限公司,GR202211005905,新材料
456,筑建秐（北京）科技有限公司,GR202211006550,新材料
457,北京金隅加气混凝土有限责任公司,GR202211007610,新材料
458,北京盛科伟业科技发展有限公司,GR202211005640,新材料
459,北京朋正华兴光电科技有限公司,GR202211008579,先进制造与自动化
460,北京天润恒远工贸有限公司,GR202211005458,先进制造与自动化
461,北京光和智控科技有限公司,GR202211008838,先进制造与自动化
462,北京电力设备总厂有限公司,GR202211008860,先进制造与自动化
463,北京铱扬慧链科技有限公司,GR202211007433,先进制造与自动化
464,北京金泰然实业有限公司,GR202211006684,先进制造与自动化
465,北京首航工业集团有限公司,GR202211006864,先进制造与自动化
466,千航（北京）科技有限公司,GR202211008009,先进制造与自动化
467,北京中威宏酒店设备有限公司,GR202211005836,先进制造与自动化
468,北京驰电自动化科技有限公司,GR202211005328,先进制造与自动化
469,北京茂丰光电科技有限公司,GR202211006002,先进制造与自动化
470,北京恒泰兴诚科技有限公司,GR202211007183,先进制造与自动化
471,北京同时开关技术有限公司,GR202211007313,先进制造与自动化
472,北京景亮工程技术有限公司,GR202211007698,先进制造与自动化
473,北京同方电气工程有限公司,GR202211007210,先进制造与自动化
474,北京兰厚化妆品有限责任公司,GR202211006629,生物与新医药
475,北京新世纪达康生物科技开发有限责任公司,GR202211007529,生物与新医药
476,北京福瑞润康生物技术有限公司,GR202211006735,生物与新医药
477,北京唯创博精生物科技有限公司,GR202211008722,生物与新医药
478,宝瑞源生物技术（北京）有限公司,GR202211007935,生物与新医药
479,北京钜嘉机械有限公司,GR202211007094,航空航天
480,北京智途云安科技有限公司,GR202211008165,高技术服务
481,城市传奇体育科技（北京）有限公司,GR202211006048,高技术服务
482,北京露森技术服务有限公司,GR202211005943,高技术服务
483,北京行走天下科技有限公司,GR202211005400,高技术服务
484,北京中城基建工程检测技术有限公司,GR202211006594,高技术服务
485,北京维新科技发展有限公司,GR202211006739,高技术服务
486,北京和腾图智科技有限公司,GR202211008572,高技术服务
487,北京元亨凯瑞建筑工程有限公司,GR202211008867,高技术服务
488,北京京津冀文化科技发展有限公司,GR202211006754,高技术服务
489,北京今展国际文化发展有限公司,GR202211008052,高技术服务
490,北京慧利顺达科技发展有限公司,GR202211006101,高技术服务
491,东方农道文化产业集团股份有限公司,GR202211005963,高技术服务
492,北京秦川大业科技有限公司,GR202211008410,高技术服务
493,中建八局检测科技有限公司,GR202211006171,高技术服务
494,北京丽贝亚健康空间科技有限公司,GR202211008226,高技术服务
495,北京汉域华科科技有限公司,GR202211007830,高技术服务
496,唯汇达科技（北京）有限公司,GR202211008246,高技术服务
497,北京嘉利智联营销管理股份有限公司,GR202211008804,高技术服务
498,开元华创科技（集团）有限公司,GR202211008415,高技术服务
499,北京华美京电电力技术开发有限公司,GR202211005901,高技术服务
500,北京皓鼎弘毅电力科技有限公司,GR202211008822,高技术服务
501,北京永旺嘉诚安全科技发展有限公司,GR202211006833,高技术服务
502,中视遐迩（北京）科技有限公司,GR202211005700,高技术服务
503,北京诺士诚国际工程项目管理有限公司,GR202211008362,高技术服务
504,北京英迈琪科技有限公司,GR202211007087,高技术服务
505,北京永正电器设备有限公司,GR202211007042,高技术服务
506,北京中仑工业微生物研究院,GR202211006315,高技术服务
507,北京长洋柒悦科技有限公司,GR202211005884,高技术服务
508,北京树铭控股集团有限公司,GR202211007957,电子信息
509,昂石通讯技术（北京）有限公司,GR202211005846,电子信息
510,北京长久博宇科技有限公司,GR202211005939,电子信息
511,北京中淇睿怡科技有限公司,GR202211008070,电子信息
512,北京莱湾兴业科技有限公司,GR202211007468,电子信息
513,云智科创（北京）科技有限公司,GR202211006207,电子信息
514,北京水木之声品牌咨询有限公司,GR202211006238,电子信息
515,北京金蝶云基科技有限公司,GR202211005907,电子信息
516,北京明德新民体育文化有限公司,GR202211006944,电子信息
517,北京天央科技有限公司,GR202211006231,电子信息
518,北京雨燕凌云科技有限公司,GR202211008005,电子信息
519,中创时代大数据集团有限公司,GR202211005374,电子信息
520,中创凯立达规划设计研究院（北京）有限公司,GR202211008129,电子信息
521,北京华捷顺高科技发展有限公司,GR202211006909,电子信息
522,北京神州数码方圆科技有限公司,GR202211006544,电子信息
523,北京君联创医药科技有限公司,GR202211008154,电子信息
524,北京锐博诚惠信息技术有限公司,GR202211008189,电子信息
525,北京华厦信通科技发展有限公司,GR202211006350,电子信息
526,北京睿声智诚科技有限责任公司,GR202211006268,电子信息
527,北京中展建工工程技术有限公司,GR202211007327,电子信息
528,华峻科技（北京）有限公司,GR202211006097,电子信息
529,中恒互联（北京）数字科技有限公司,GR202211005606,电子信息
530,万谦科技（北京）有限公司,GR202211007693,电子信息
531,北京北智天成科技发展有限公司,GR202211008694,电子信息
532,北京证通智远科技有限公司,GR202211008284,电子信息
533,北京智联万通技术服务有限公司,GR202211008233,电子信息
534,北京天润顺腾科技有限公司,GR202211007988,电子信息
535,北京唯得睿信息咨询有限公司,GR202211005770,电子信息
536,北京安佑盾智能科技发展有限公司,GR202211006398,电子信息
537,北京创新谷科技孵化器有限公司,GR202211005784,电子信息
538,北京云筑在线科技有限公司,GR202211006396,电子信息
539,北京中海联诚科技有限公司,GR202211006892,电子信息
540,北京心华石科技有限公司,GR202211007293,电子信息
541,北京天璟空间技术服务有限公司,GR202211008649,电子信息
542,北京帮邦通达医疗器械有限公司,GR202211008671,电子信息
543,北京亿忆科技有限公司,GR202211007588,高技术服务
544,北京正通诚远科技发展有限公司,GR202211008252,高技术服务
545,北京俭云实验科技有限公司,GR202211007406,高技术服务
546,北京绿效建筑科技有限公司,GR202211005627,高技术服务
547,北京智享新科技有限公司,GR202211006894,高技术服务
548,北京时代润华环境科技有限公司,GR202211005812,高技术服务
549,北京龙腾汇悦建设工程有限公司,GR202211007863,高技术服务
550,松金市场咨询（北京）有限公司,GR202211008117,高技术服务
551,北京肆世一大道文化传媒有限公司,GR202211007360,高技术服务
552,笔墨印迹（北京）文化有限公司,GR202211008181,高技术服务
553,北京月儿湾教育咨询有限公司,GR202211008630,高技术服务
554,北京圣通管理咨询有限公司,GR202211005879,高技术服务
555,北京荣光企业管理有限公司,GR202211008177,高技术服务
556,北京统祥文化传播有限公司,GR202211008328,高技术服务
557,北京五祥环保科技有限公司,GR202211006785,高技术服务
558,北京海河知识产权代理有限公司,GR202211005447,高技术服务
559,北京天策环保工程有限公司,GR202211006288,高技术服务
560,北京水碧治建筑科技有限公司,GR202211006729,高技术服务
561,拾捌艺（北京）品牌管理股份有限公司,GR202211006819,高技术服务
562,北京博科建筑工程有限公司,GR202211006685,高技术服务
563,北京吉顺建筑工程有限公司,GR202211007568,高技术服务
564,北京乐遇智信科技服务有限公司,GR202211005368,高技术服务
565,北京盛聚玄德商贸有限公司,GR202211008276,生物与新医药
566,北京市香香唯一食品厂,GR202211006766,生物与新医药
567,北京考利特电器设备有限责任公司,GR202211006602,先进制造与自动化
568,中能联合（北京）电力有限公司,GR202211006708,先进制造与自动化
569,北京史河机器人科技有限公司,GR202211005292,先进制造与自动化
570,北京融诚信达科技发展有限公司,GR202211007772,先进制造与自动化
571,中氢投电力（北京）有限公司,GR202211008839,先进制造与自动化
572,北京燕山祥顺聚氨脂防腐保温材料有限公司,GR202211006405,先进制造与自动化
573,普丽美家科技（北京）有限公司,GR202211006640,新材料
574,理工清科（北京）科技有限公司,GR202211005935,新材料
575,北京京宇一美生物科技有限责任公司,GR202211006488,新材料
576,清知源（北京）环保科技有限公司,GR202211008414,资源与环境
577,北京郅航科技有限公司,GR202211007014,新能源与节能
578,北京联华凯越机电设备有限公司,GR202211006153,新能源与节能
579,北京泽曦平安科技有限公司,GR202211005703,新能源与节能
580,北京瀚广成威实验室装备工程技术有限公司,GR202211008250,先进制造与自动化
581,核航宏锐（北京）科技有限公司,GR202211005454,先进制造与自动化
582,青旅智慧园（北京）国际商业运营管理有限公司,GR202211006201,高技术服务
583,北京利豪珈源建材有限公司,GR202211007421,高技术服务
584,北京中新安泰建筑工程有限公司,GR202211007927,高技术服务
585,北京华伟恒远信息系统技术有限公司,GR202211008684,电子信息
586,数联信智（北京）科技有限公司,GR202211007068,电子信息
587,北京煜海东方电子科技有限公司,GR202211007700,高技术服务
588,北京丰德兰志包装技术有限公司,GR202211006113,新材料
589,北京中科华纳技术发展有限公司,GR202211006031,新材料
590,北京京龙泰达商贸有限公司,GR202211007817,新材料
591,北京鼎成天熠文化传媒有限公司,GR202211005481,高技术服务
592,蓝白灰（北京）系统工程有限公司,GR202211008425,高技术服务
593,北京玖合云创数字科技有限公司,GR202211007960,电子信息
594,北京确实科技股份有限公司,GR202211006290,高技术服务
595,北京中能安信科技发展有限公司,GR202211006372,电子信息
596,仙豪六位仙食品科技（北京）有限公司,GR202211008476,高技术服务
597,北京轻松新源科技有限公司,GR202211006743,资源与环境
598,北京华夏平安净水设备有限公司,GR202211007083,资源与环境
599,北京市永康药业有限公司,GS202211000101,生物与新医药
600,北京八亿时空液晶科技股份有限公司,GS202211000097,新材料
601,北京华素制药股份有限公司,GS202211000128,生物与新医药
602,北京上品科技发展有限责任公司,GR202211008971,电子信息
603,北京昊天防火材料厂,GR202211009002,新材料
604,奕江山环境科技（北京）有限公司,GR202211009035,资源与环境
605,泰格领航（北京）农业技术有限公司,GR202211009108,高技术服务
606,首望体验科技文化有限公司,GR202211009040,高技术服务
607,北京华夏首科科技有限公司,GR202211009105,高技术服务
608,中远酒店物业管理有限公司,GR202211009028,高技术服务
609,北京格瑞朗博科技发展有限公司,GR202211009042,新材料
610,中创时代知识产权顾问（北京）有限公司,GR202211009081,高技术服务
611,北京企转转科技有限公司,GR202311000369,电子信息
612,中启智慧（北京）科技有限责任公司,GR202311000230,电子信息
613,华博云（北京）技术有限公司,GR202311000532,电子信息
614,北京众联国信科技有限公司,GR202311000113,电子信息
615,北京有花果文化传媒有限公司,GR202311000102,高技术服务
616,北京中天利达建设工程有限公司,GR202311000246,高技术服务
617,北京今日蓝天科技有限公司,GR202311000104,航空航天
618,北京澳特舒尔保健品开发有限公司,GR202311000071,生物与新医药
619,新基元（北京）医药科技有限公司,GR202311000060,生物与新医药
620,北京安龙特种车辆有限公司,GR202311000109,先进制造与自动化
621,北京京能燕开综合能源服务有限公司,GR202311000277,新能源与节能
622,北京商和建设集团有限公司,GR202311000610,新能源与节能
623,北京盈和瑞环境科技有限公司,GR202311000534,资源与环境
624,北京华宇辉煌生态环保科技股份有限公司,GR202311000080,资源与环境
625,北京智安云图科技有限公司,GR202311003098,电子信息
626,北京一链数云科技有限公司,GR202311002350,电子信息
627,北京普雷瑞科技有限公司,GR202311001083,电子信息
628,北京洪威先创科技股份有限公司,GR202311003296,电子信息
629,北京惠丰学信教育科技有限公司,GR202311002557,电子信息
630,北京万联世纪科技有限公司,GR202311003406,电子信息
631,北京安录国际技术有限公司,GR202311003488,电子信息
632,北京金点创智科技有限公司,GR202311002986,电子信息
633,北京数智大观科技有限公司,GR202311001934,电子信息
634,北京甲虎文化传播有限公司,GR202311002569,电子信息
635,北京嘉洪信息技术有限公司,GR202311002148,电子信息
636,北京佳云保信息技术有限公司,GR202311002943,电子信息
637,博雅云捷（北京）信息技术有限公司,GR202311001725,电子信息
638,光环新网（北京）数据服务有限公司,GR202311001750,电子信息
639,北京大有天成工程咨询有限公司,GR202311002005,高技术服务
640,北京远望空间文化科技有限公司,GR202311001850,高技术服务
641,北京紫衡轩建筑工程检测有限公司,GR202311003246,高技术服务
642,北京迅邦润泽物流有限公司,GR202311002904,高技术服务
643,北京辰森智宇科技有限公司,GR202311002570,高技术服务
644,北京华信恒泰建设工程有限公司,GR202311001133,高技术服务
645,北京宝辰工程管理股份有限公司,GR202311003371,高技术服务
646,北京国艺中联文投科技股份有限公司,GR202311001568,高技术服务
647,北京感易智能科技有限公司,GR202311002040,高技术服务
648,超维远见（北京）科技有限公司,GR202311002517,高技术服务
649,学科网（北京）股份有限公司,GR202311000854,高技术服务
650,东华云计算有限公司,GR202311000670,高技术服务
651,北碳优能（北京）科技有限公司,GR202311002893,高技术服务
652,北京甲虎教育科技有限公司,GR202311003194,高技术服务
653,北京燕化正邦设备检修有限公司,GR202311000904,高技术服务
654,北京华速物流有限公司,GR202311000775,高技术服务
655,北京汇正卓越科技有限公司,GR202311002874,高技术服务
656,中润成（北京）建设工程有限公司,GR202311002359,高技术服务
657,北京石人子装备科技有限公司,GR202311000825,航空航天
658,北京星际导控科技有限责任公司,GR202311001907,航空航天
659,北京天仁道和新材料有限公司,GR202311003179,航空航天
660,太和康美（北京）中医研究院有限公司,GR202311001185,生物与新医药
661,北京中农俊景科技有限公司,GR202311001391,生物与新医药
662,北京六一生物科技有限公司,GR202311003351,生物与新医药
663,北京艾克赛德生物工程有限公司,GR202311003324,生物与新医药
664,富乐顿生物工程科技（北京）有限公司,GR202311001637,生物与新医药
665,北京兆兴纸制品有限责任公司,GR202311002578,先进制造与自动化
666,保利（北京）船舶科技有限公司,GR202311003363,先进制造与自动化
667,北京华拓绿能科技有限公司,GR202311001961,先进制造与自动化
668,北京盛大远景科技有限公司,GR202311000798,先进制造与自动化
669,北京龙德缘智能电力有限公司,GR202311003268,先进制造与自动化
670,基康仪器股份有限公司,GR202311002166,先进制造与自动化
671,北京百盛华高机电设备有限公司,GR202311006709,先进制造与自动化
672,北京普凡防护科技有限公司,GR202311002156,新材料
673,中润超油（北京）新材料有限公司,GR202311003070,新材料
674,北京高盟新材料股份有限公司,GR202311001499,新材料
675,北京金隅砂浆有限公司,GR202311002521,新材料
676,北京冠华东方玻璃科技有限公司,GR202311003072,新材料
